<?xml version="1.0" encoding="UTF-8"?>
<!DOCTYPE comunidad SYSTEM "vecindario.dtd">
<comunidad>
    <vecinos>
        <cod_vecino carg="presidente">001</cod_vecino>
        <nombre nom="Juan"></nombre>
        <apellidos apel="Pérez"></apellidos>
    </vecinos>
    <vecinos>
        <cod_vecino carg="vicepresidente">002</cod_vecino>
        <nombre nom="Ana"></nombre>
        <apellidos apel="García"></apellidos>
        <portal port="B"></portal>
        <pisoyletra piso="2B"></pisoyletra>
    </vecinos>
    <vecinos>
        <cod_vecino carg="secretario">003</cod_vecino>
        <nombre nom="Carlos"></nombre>
        <apellidos apel="Ruiz"></apellidos>
        <portal port="C"></portal>
        <pisoyletra piso="3C"></pisoyletra>
        <cod_cuenta_ord ccc="ES1122334455"></cod_cuenta_ord>
    </vecinos>
    <vecinos>
    </vecinos>
</comunidad>